<?xml version="1.0" encoding="UTF-8"?>
<project xmlns:xsi="http://www.w3.org/2001/XMLSchema-instance"
         xsi:noNamespaceSchemaLocation="../../src/main/resources/config.xml.xsd">
    <commands>
        <load-useragent-command/>
        <load-proxy-command key="yandex"/>

        <generate-string-command name="login" minSize="8" maxSize="14" appendDigits="true"/>
        <generate-string-command name="password" minSize="6" maxSize="8" appendDigits="true"/>
        <generate-string-command name="iname" minSize="6" maxSize="10" appendDigits="false"/>
        <generate-string-command name="fname" minSize="6" maxSize="8" appendDigits="false"/>
        <generate-string-command name="answer" minSize="5" maxSize="10" appendDigits="false"/>

        <get-request-command
                url="http://passport.yandex.ru/passport?mode=auth&amp;from=narod&amp;retpath=http://narod.yandex.ru/"
                referer="http://narod.yandex.ru/">
            <extract-commands>
                <!--<extract-xpath-variable name="register_url" query="//div[@class='b-domik__link']/a" field="href"/>-->
                <extract-regexp-variable name="register_url"
                                         pattern="class=&quot;b-domik__link&quot; href=&quot;(.*)&quot; tabindex=&quot;30&quot;"/>
            </extract-commands>
        </get-request-command>

        <get-request-command url="${register_url}"
                             referer="http://passport.yandex.ru/passport?mode=auth&amp;from=narod&amp;retpath=http://narod.yandex.ru/">
            <extract-commands>
                <extract-attr-value-variable name="idkey" attribute="name" value="idkey" field="value"/>
                <extract-attr-value-variable name="steponeurl" attribute="name" value="bigForm" field="action"/>
            </extract-commands>
        </get-request-command>

        <post-request-command url="${steponeurl}"
                              referer="http://passport.yandex.ru/passport?mode=register&amp;msg=mail&amp;retpath=http%3A%2F%2Fnarod.yandex.ru%2F">
            <post-parameters>
                <post-parameter name="idkey" value="${idkey}"/>
                <post-parameter name="step" value="one"/>
                <post-parameter name="fresh" value="3"/>
                <post-parameter name="filled" value="yes"/>
                <post-parameter name="iname" value="${iname}"/>
                <post-parameter name="fname" value="${fname}"/>
                <post-parameter name="login" value="${login}"/>
                <post-parameter name="done" value="Дальше →"/>
            </post-parameters>

            <extract-commands>
                <extract-attr-value-variable name="idkey" attribute="name" value="idkey" field="value"/>
                <extract-attr-value-variable name="imageurl" attribute="class" value="captcha-img" field="src"/>
                <extract-attr-value-variable name="steptwourl" attribute="name" value="bigForm" field="action"/>
            </extract-commands>
        </post-request-command>

        <save-image-command name="imagedata" url="${imageurl}"/>

        <anti-captcha-command name="captcha_response" image="${imagedata}" ext="gif" phrase="false"/>

        <generate-time-command name="current_time"/>

        <post-request-command url="${steptwourl}" referer="${steponeurl}">
            <post-parameters>
                <post-parameter name="idkey" value="${idkey}"/>
                <post-parameter name="step" value="two"/>
                <post-parameter name="filled" value="yes"/>
                <post-parameter name="login" value="${login}"/>
                <post-parameter name="fname" value="${fname}"/>
                <post-parameter name="iname" value="${iname}"/>
                <post-parameter name="time" value="${current_time}"/>
                <post-parameter name="gmt_offset" value="-120"/>
                <post-parameter name="passwd" value="${password}"/>
                <post-parameter name="passwd2" value="${password}"/>
                <post-parameter name="hintq" value="2"/>
                <post-parameter name="udhintq" value=""/>
                <post-parameter name="hinta" value="${answer}"/>
                <post-parameter name="hintasave" value="${answer}"/>
                <!--<post-parameter name="questnum" value=""/>-->
                <!--<post-parameter name="hintqsave" value=""/>-->
                <post-parameter name="email" value=""/>
                <post-parameter name="phonenumber" value=""/>
                <post-parameter name="code" value="${captcha_response}"/>
                <post-parameter name="agreed" value="yes"/>
                <!--<post-parameter name="newform" value="Зарегистрировать"/>-->
            </post-parameters>
            <test-commands>
                <element-test attribute="class" value="b-error" expected="false"
                              message="account registered successfully"/>
            </test-commands>
        </post-request-command>
        <get-request-command
                url="http://passport.yandex.ru/passport?mode=auth&amp;msg=narod&amp;retpath=http://narod.yandex.ru/"
                referer="http://narod.yandex.ru/">
        </get-request-command>

        <generate-time-command name="timestamp"/>

        <post-request-command url="https://passport.yandex.ru/passport?mode=auth"
                              referer="http://passport.yandex.ru/passport?mode=auth&amp;msg=narod&amp;retpath=http://narod.yandex.ru/">
            <post-parameters>
                <post-parameter name="idkey" value="${idkey}"/>
                <post-parameter name="login" value="${login}"/>
                <post-parameter name="passwd" value="${password}"/>
                <post-parameter name="timestamp" value="${timestamp}"/>
                <post-parameter name="retpath" value="http://narod.yandex.ru/"/>
            </post-parameters>
        </post-request-command>

        <get-request-command url="http://mail.yandex.ru/">
            <test-commands>
                <email-test login="${login}" password="${password}" host="pop.yandex.ru"/>
            </test-commands>
        </get-request-command>

        <get-request-command url="http://narod.yandex.ru/">
            <extract-commands>
                <extract-attr-value-variable name="diskurl" attribute="class" value="button b-button-create"
                                             field="href"/>
            </extract-commands>
        </get-request-command>
        <get-request-command url="http://narod.yandex.ru${diskurl}" referer="http://narod.yandex.ru/">
            <test-commands>
                <ftp-test login="${login}" password="${password}" host="ftp.narod.ru"
                          message="ftp activated successfully"/>
            </test-commands>
        </get-request-command>


        <save-email-command email="${login}@yandex.ru" host="pop.yandex.ru" user="${login}" password="${password}"
                            type="yandex"/>
        <save-ftp-account-command url="http://${login}.narod.ru" login="${login}" password="${password}"
                                  host="ftp.narod.ru"
                                  prefix=""
                                  type="narod"/>
    </commands>
</project>