<project xmlns:xsi="http://www.w3.org/2001/XMLSchema-instance" xsi:noNamespaceSchemaLocation="../config.xml.xsd">
    <commands>

        <anti-captcha-command name="captcha" image="${image_var}" ext="jpg" phrase="false"/>
        <check-email-command login="login" password="password" host="host"/>
        <check-email-command login="login" password="password" host="host"/>

        <check-ftp-account-command login="login" password="password" host="host"/>

        <delete-email-command email="test@asd.ru"/>

        <email-command login="${emaillogin}" password="${emailpassword}" host="${emailhost}" sleep="15000" attempts="5">
            <extract-commands>
                <extract-regexp-variable name="uid" pattern="(.+)"/>
                <extract-regexp-variable name="uid" pattern="(.+)"/>
                <extract-xpath-variable name="captchaurl" xpath="//user" value-field="value"/>
                <extract-attr-value-variable name="password" attribute="input" value="value" value-field="value"/>
            </extract-commands>
        </email-command>

        <anti-captcha-command name="captcha" image="${image_var}" ext="jpg" phrase="false"/>
        <generate-string-command name="string" minSize="5" maxSize="6" appendDigits="false"/>

        <load-email-command prefix="email" host="mail.clovermail.net"/>

        <load-ftp-account-command prefix="ftp_" type="narod"/>

        <load-useragent-command/>

        <load-proxy-command key="narod.ru"/>

        <get-request-command url="http://google.com" referrer="http://tut.by">
            <extract-commands>
                <extract-regexp-variable name="uid" pattern="(.+)"/>
                <extract-xpath-variable name="captchaurl" xpath="//user" value-field="value"/>
                <extract-xpath-variable name="captchaurl" xpath="//user" value-field="value"/>
                <extract-attr-value-variable name="password" attribute="input" value="value" value-field="value"/>
            </extract-commands>
        </get-request-command>

        <save-image-command name="firstimage" url="http://site.com/image.jpg"/>

        <recaptcha-command name="recaptcha_challenge1" url="${recaptcha_url1}" image="${recaptcha_response1}"/>

        <post-request-command url="${request-url-var}" referer="${ref-var}">
            <post-parameters>
                <post-parameter name="login" value="dwh"/>
                <post-parameter name="password" value="pass"/>
            </post-parameters>
            <extract-commands>
                <extract-regexp-variable name="uid" pattern="(.+)"/>
                <extract-xpath-variable name="captchaurl" xpath="//user" value-field="value"/>
                <extract-xpath-variable name="captchaurl" xpath="//user" value-field="value"/>
                <extract-xpath-variable name="captchaurl" xpath="//user" value-field="value"/>
                <extract-attr-value-variable name="password" attribute="input" value="value" value-field="value"/>
                <extract-attr-value-variable name="password" attribute="input" value="value" value-field="value"/>
            </extract-commands>
            <test-commands>
                <string-test value="Widget[Location]_country" expected="false"/>
                <ftp-test login="login" password="password" host="host" message="test failed"/>
                <ftp-test login="login" password="password" host="host" message="test failed"/>
                <email-test login="login" password="password" host="host" message="test failed"/>
            </test-commands>
        </post-request-command>

        <save-blog-command type="type" url="url" xmlrpc="xml" login="login" password="password"/>

        <save-email-command email="email" host="host" user="user" password="password" type="type"/>

        <save-ftp-account-command url="url" login="login" password="password" host="host" prefix="prefix" type="type"/>
    </commands>
</project>