<?xml version="1.0" encoding="UTF-8"?>
<project xmlns:xsi="http://www.w3.org/2001/XMLSchema-instance"
         xsi:noNamespaceSchemaLocation="../../src/main/resources/config.xml.xsd">
    <commands>
        <load-useragent-command/>

        <get-request-command url="http://zymic.com/"/>

        <post-request-command url="http://zymic.com/backend/login_process.php" referer="http://zymic.com/">
            <post-parameters>
                <post-parameter name="username" value="testtest123"/>
                <post-parameter name="password" value="fakepass1"/>
                <post-parameter name="persist-session" value="on"/>
                <post-parameter name="submit-form" value="Login"/>
            </post-parameters>
        </post-request-command>

        <get-request-command url="http://www.zymic.com/register-website/" referer="http://zymic.com/">

        </get-request-command>

        <post-request-command url="http://www.zymic.com/register-website/" referer="http://www.zymic.com/register-website/">
            <post-parameters>
                <post-parameter name="sitename" value="lkdjfglsjdg1234"/>
                <post-parameter name="domain" value="1"/>
            </post-parameters>
        </post-request-command>

        <get-request-command url="http://www.zymic.com/register-website/step2/" referer="http://www.zymic.com/register-website/">

        </get-request-command>

        <post-request-command url="http://www.zymic.com/register-website/step2/" referer="http://www.zymic.com/register-website/step2/">
            <post-parameters>
                <post-parameter name="password" value="fakepass1"/>
                <post-parameter name="passwordv" value="fakepass1"/>
            </post-parameters>
        </post-request-command>

        <get-request-command url="http://www.zymic.com/register-website/step3/" referer="http://www.zymic.com/register-website/step2/">
            <extract-commands>
                <extract-regexp-variable name="recaptcha_url1"
                                         pattern="&quot;(http://api.recaptcha.net/challenge.+?)&quot;"/>

            </extract-commands>
        </get-request-command>

        <recaptcha-command name="recaptcha_challenge1" url="${recaptcha_url1}" image="recaptcha_response1"/>

        <post-request-command url="http://www.zymic.com/register-website/step3#form" referer="http://www.zymic.com/register-website/step3">
            <post-parameters>
                <post-parameter name="agree1" value="on"/>
                <post-parameter name="agree2" value="on"/>
                <post-parameter name="agree3" value="on"/>
                <post-parameter name="recaptcha_challenge_field" value="${recaptcha_challenge1}"/>
                <post-parameter name="recaptcha_response_field" value="${recaptcha_response1}"/>
            </post-parameters>
        </post-request-command>

    </commands>
</project>